URL_ID,URL,TITLE,POSITIVE SCORE,NEGATIVE SCORE,POLARITY SCORE,SUBJECTIVITY SCORE,AVG SENTENCE LENGTH,PERCENTAGE OF COMPLEX WORDS,FOG INDEX,COMPLEX WORD COUNT,WORD COUNT,SYLLABLE PER WORD,PERSONAL PRONOUNS,AVG WORD LENGTH
bctech2011,https://insights.blackcoffer.com/ml-and-ai-based-insurance-premium-model-to-predict-premium-to-be-charged-by-the-insurance-company/,ML and AI-based insurance premium model to predict premium to be charged by the insurance company,2,0,0.9999995,0.124999992,16,60,30.4,6,10,28,0,5.125
bctech2012,https://insights.blackcoffer.com/streamlined-integration-interactive-brokers-api-with-python-for-desktop-trading-application/,Streamlined Integration: Interactive Brokers API with Python for Desktop Trading Application,1,0,0.999999,0.083333326,12,33.33333333,18.13333333,3,9,27,0,6.833333333
bctech2013,https://insights.blackcoffer.com/efficient-data-integration-and-user-friendly-interface-development-navigating-challenges-in-web-application-deployment/,Efficient Data Integration and User-Friendly Interface Development: Navigating Challenges in Web Application Deployment,2,0,0.9999995,0.142857133,14,81.81818182,38.32727273,9,11,37,0,7.642857143
bctech2014,https://insights.blackcoffer.com/effective-management-of-social-media-data-extraction-strategies-for-authentication-security-and-reliability/,"Effective Management of Social Media Data Extraction: Strategies for Authentication, Security, and Reliability",1,0,0.999999,0.062499996,16,90,42.4,9,10,35,0,6.125
bctech2015,https://insights.blackcoffer.com/streamlined-trading-operations-interface-for-metatrader-4-empowering-efficient-management-and-monitoring/,Streamlined Trading Operations Interface for MetaTrader 4: Empowering Efficient Management and Monitoring,2,0,0.9999995,0.153846142,13,60,29.2,6,10,34,0,7.230769231
bctech2016,https://insights.blackcoffer.com/efficient-aws-infrastructure-setup-and-management-addressing-security-scalability-and-compliance/,"Efficient AWS Infrastructure Setup and Management: Addressing Security, Scalability, and Compliance",1,0,0.999999,0.071428566,14,66.66666667,32.26666667,6,9,29,0,6.357142857
bctech2017,https://insights.blackcoffer.com/streamlined-equity-waterfall-calculation-and-deal-management-system/,Streamlined Equity Waterfall Calculation and Deal Management System,1,0,0.999999,0.124999984,8,57.14285714,26.05714286,4,7,19,0,7.5
bctech2018,https://insights.blackcoffer.com/automated-orthopedic-case-report-generation-harnessing-web-scraping-and-ai-integration/,Automated Orthopedic Case Report Generation: Harnessing Web Scraping and AI Integration,0,0,0,0,12,70,32.8,7,10,28,0,6.416666667
bctech2019,https://insights.blackcoffer.com/streamlining-time-calculation-in-warehouse-management-leveraging-shiphero-api-and-google-bigquery-integration/,Streamlining Time Calculation in Warehouse Management: Leveraging ShipHero API and Google BigQuery Integration,0,0,0,0,14,45.45454545,23.78181818,5,11,36,0,7
bctech2020,https://insights.blackcoffer.com/efficient-database-design-and-management-streamlining-access-and-integration-for-partner-entity-management/,Efficient Database Design and Management: Streamlining Access and Integration for Partner Entity Management,1,0,0.999999,0.071428566,14,70,33.6,7,10,33,0,6.785714286
bctech2021,https://insights.blackcoffer.com/automated-campaign-management-system-a-comprehensive-solution-with-linkedin-and-email-integration/,Automated Campaign Management System: A Comprehensive Solution with LinkedIn and Email Integration,1,0,0.999999,0.076923071,13,55.55555556,27.42222222,5,9,31,0,6.692307692
bctech2022,https://insights.blackcoffer.com/ai-driven-data-analysis-ai-tool-using-langchain-for-a-leading-real-estate-and-financing-firm-worldwide/,AI-driven data analysis AI tool using Langchain for a leading real estate and financing firm worldwide,1,0,0.999999,0.062499996,16,30.76923077,18.70769231,4,13,29,0,5.4375
bctech2023,https://insights.blackcoffer.com/grafana-dashboard-to-visualize-and-analyze-sensors-data/,Grafana Dashboard to visualize and analyze sensors’ data,0,0,0,0,9,42.85714286,20.74285714,3,7,18,0,5.444444444
bctech2024,https://insights.blackcoffer.com/mvp-for-a-software-that-analyses-content-from-audio-pharma-based/,MVP for a software that analyses content from audio (Pharma-based),0,0,0,0,12,66.66666667,31.46666667,4,6,18,0,4.75
bctech2025,https://insights.blackcoffer.com/data-engineering-and-management-tool-airbyte-with-custom-data-connectors-to-manage-crm-database/,Data Engineering and Management tool (Airbyte) with custom data connectors to manage CRM database,0,0,0,0,16,63.63636364,31.85454545,7,11,29,0,5.25
bctech2026,https://insights.blackcoffer.com/text-summarizing-tool-to-scrape-and-summarize-pubmed-medical-papers/,Text Summarizing Tool to scrape and summarize pubmed medical papers,0,0,0,0,10,37.5,19,3,8,21,0,5.8
bctech2027,https://insights.blackcoffer.com/7up7down-10updown-snakes-and-ladder-games-built-using-oops/,"7up7down, 10upDown, Snakes and Ladder Games built using OOPs",0,0,0,0,11,0,4.4,0,8,15,0,4.727272727
bctech2028,https://insights.blackcoffer.com/data-studio-dashboard-with-a-data-pipeline-tool-synced-with-podio-using-custom-webhooks-and-google-cloud-function/,Data Studio Dashboard with a data pipeline tool synced with Podio using custom Webhooks and Google Cloud Function,0,0,0,0,18,21.42857143,15.77142857,3,14,31,0,5.333333333
bctech2029,https://insights.blackcoffer.com/end-to-end-tool-to-optimize-routing-and-planning-of-field-engineers-using-googles-cvrp-tw-algorithm/,End-to-end tool to optimize routing and planning of field engineers using Google’s CVRP-TW algorithm,0,0,0,0,16,33.33333333,19.73333333,4,12,26,0,5.4375
bctech2030,https://insights.blackcoffer.com/end-to-end-tool-to-predict-biofuel-prices-using-ieso-data/,End-to-end tool to predict Biofuel prices using IESO data,0,0,0,0,9,37.5,18.6,3,8,17,0,5.444444444
bctech2031,https://insights.blackcoffer.com/etl-discovery-tool-using-llma-langchain-openai/,"ETL Discovery Tool using LLMA, Langchain, OpenAI",0,0,0,0,9,14.28571429,9.314285714,1,7,13,0,4.666666667
bctech2032,https://insights.blackcoffer.com/gpt-ocr-api/,GPT/OCR API,0,0,0,0,2,0,0.8,0,2,3,0,5
bctech2033,https://insights.blackcoffer.com/dockerize-the-aws-lambda-for-serverless-architecture/,Dockerize the AWS Lambda for serverless architecture,0,0,0,0,7,20,10.8,1,5,16,0,6.571428571
bctech2034,https://insights.blackcoffer.com/design-and-develop-a-product-recommendation-engine-based-on-the-features-of-products/,Design and develop a product recommendation engine based on the features of products,1,0,0.999999,0.076923071,13,50,25.2,4,8,27,0,5.538461538
bctech2035,https://insights.blackcoffer.com/database-discovery-tool-using-openai/,Database Discovery Tool using OpenAI,0,0,0,0,5,40,18,2,5,13,0,6.4
bctech2036,https://insights.blackcoffer.com/automate-the-data-management-process/,Automate the Data Management Process,0,0,0,0,5,100,42,4,4,13,0,6.4
bctech2037,https://insights.blackcoffer.com/realtime-kibana-dashboard-for-a-financial-tech-firm/,Realtime Kibana Dashboard for a financial tech firm,0,0,0,0,8,16.66666667,9.866666667,1,6,15,0,5.5
bctech2038,https://insights.blackcoffer.com/data-management-etl-and-data-automation/,"Data Management, ETL, and Data Automation",0,0,0,0,8,80,35.2,4,5,14,0,4.5
bctech2039,https://insights.blackcoffer.com/data-management-egeas/,Data Management - EGEAS,0,0,0,0,4,66.66666667,28.26666667,2,3,8,0,5
bctech2040,https://insights.blackcoffer.com/design-and-develop-powershell-script/,Design and develop PowerShell script,0,0,0,0,5,25,12,1,4,10,0,6.4
bctech2041,https://insights.blackcoffer.com/design-and-develop-jenkins-shared-library/,Design and develop Jenkins shared library,0,0,0,0,6,60,26.4,3,5,12,0,6
bctech2042,https://insights.blackcoffer.com/design-and-develop-retool-app-for-wholecell-io-and-asana-data-using-their-apis/,Design and develop retool app for wholecell.io and Asana data using their api’s,0,0,0,0,7.5,20,11,2,10,25,1,4.466666667
bctech2043,https://insights.blackcoffer.com/design-and-develop-a-retool-app-that-will-show-stock-and-crypto-related-information-using-iex-api/,Design and develop a retool app that will show stock and crypto related information using IEX API,0,0,0,0,17,25,16.8,3,12,28,0,4.764705882
bctech2044,https://insights.blackcoffer.com/crm-monday-com-make-com-to-data-warehouse-to-klipfolio-dashboard/,"CRM (Monday.com, Make.com) to Data Warehouse to Klipfolio Dashboard",0,0,0,0,4,14.28571429,7.314285714,1,7,19,0,4.916666667
bctech2045,https://insights.blackcoffer.com/ner-task-using-bert-with-data-in-xml-format/,NER Task using BERT with data in XML-format,0,0,0,0,8,16.66666667,9.866666667,1,6,11,0,4.5
bctech2046,https://insights.blackcoffer.com/qualtrics-api-integration-using-python/,Qualtrics API integration using Python,0,0,0,0,5,20,10,1,5,11,0,6.8
bctech2047,https://insights.blackcoffer.com/design-and-develop-mlops-framework-for-data-centric-ai/,Design and develop MLops framework for Data-centric AI,0,0,0,0,8,33.33333333,16.53333333,2,6,16,0,5.875
bctech2048,https://insights.blackcoffer.com/nlp-based-approach-for-data-transformation/,NLP-based Approach for Data Transformation,0,0,0,0,5,50,22,2,4,11,0,7.6
bctech2049,https://insights.blackcoffer.com/an-etl-tool-to-pull-data-from-shiphero-to-google-bigquery-data-warehouse/,An ETL tool to pull data from Shiphero to Google Bigquery Data Warehouse,0,0,0,0,13,22.22222222,14.08888889,2,9,21,0,4.615384615
bctech2050,https://insights.blackcoffer.com/plaid-financial-analytics-a-data-driven-dashboard-to-generate-insights/,Plaid Financial Analytics - A Data-Driven Dashboard to generate insights,0,0,0,0,10,42.85714286,21.14285714,3,7,21,0,6.3
bctech2051,https://insights.blackcoffer.com/recommendation-engine-for-insurance-sector-to-expand-business-in-the-rural-area/,Recommendation Engine for Insurance Sector to Expand Business in the Rural Area,1,0,0.999999,0.083333326,12,62.5,29.8,5,8,27,0,5.666666667
bctech2052,https://insights.blackcoffer.com/data-from-crm-via-zapier-to-google-sheets-dynamic-to-powerbi/,Data from CRM via Zapier to Google Sheets (Dynamic) to PowerBI,1,0,0.999999,0.076923071,13,37.5,20.2,3,8,16,0,4
bctech2053,https://insights.blackcoffer.com/data-warehouse-to-google-data-studio-looker-dashboard/,Data Warehouse to Google Data Studio (Looker) Dashboard,0,0,0,0,10,42.85714286,21.14285714,3,7,17,0,4.8
bctech2054,https://insights.blackcoffer.com/crm-monday-com-via-zapier-to-power-bi-dashboard/,"CRM, Monday.com via Zapier to Power BI Dashboard",0,0,0,0,4.5,14.28571429,7.514285714,1,7,12,0,4.555555556
bctech2055,https://insights.blackcoffer.com/monday-com-to-kpi-dashboard-to-manage-view-and-generate-insights-from-the-crm-data/,"Monday.com to KPI Dashboard to manage, view, and generate insights from the CRM data",0,0,0,0,8,33.33333333,16.53333333,3,9,23,0,4.4375
bctech2056,https://insights.blackcoffer.com/data-management-for-a-political-saas-application/,Data Management for a Political SaaS Application,0,0,0,0,7,80,34.8,4,5,17,0,6
bctech2057,https://insights.blackcoffer.com/google-lsa-ads-google-local-service-ads-etl-tools-and-dashboards/,Google LSA Ads (Google Local Service Ads) – ETL tools and Dashboards,0,0,0,0,14,9.090909091,9.236363636,1,11,17,0,4.071428571
bctech2058,https://insights.blackcoffer.com/ad-networks-marketing-campaign-data-dashboard-in-looker-google-data-studio/,Ad Networks Marketing Campaign Data Dashboard in Looker (Google Data Studio),0,0,0,0,13,40,21.2,4,10,21,0,5.076923077
bctech2059,https://insights.blackcoffer.com/analytical-solution-for-a-tech-firm/,Analytical solution for a tech firm,0,0,0,0,6,50,22.4,2,4,11,0,5
bctech2060,https://insights.blackcoffer.com/ai-solution-for-a-technology-information-and-internet-firm/,"AI solution for a Technology, Information and Internet firm",0,0,0,0,10,83.33333333,37.33333333,5,6,18,0,5.1
bctech2061,https://insights.blackcoffer.com/ai-and-nlp-based-solutions-to-automate-data-discovery-for-venture-capital-and-private-equity-principals/,AI and NLP-based Solutions to Automate Data Discovery for Venture Capital and Private Equity Principals,0,0,0,0,15,72.72727273,35.09090909,8,11,33,0,5.933333333
bctech2062,https://insights.blackcoffer.com/an-etl-solution-for-an-internet-publishing-firm/,An ETL solution for an Internet Publishing firm,0,0,0,0,8,60,27.2,3,5,14,0,5
bctech2063,https://insights.blackcoffer.com/ai-based-algorithmic-trading-bot-for-forex/,AI-Based Algorithmic Trading Bot for Forex,0,0,0,0,6,0,2.4,0,5,13,0,6.166666667
bctech2064,https://insights.blackcoffer.com/equity-waterfalls-model-based-saas-application-for-real-estate-sector/,Equity Waterfalls Model-Based SaaS Application for Real Estate Sector,0,0,0,0,9,37.5,18.6,3,8,21,0,6.777777778
bctech2065,https://insights.blackcoffer.com/ai-solutions-for-foreign-exchange-an-automated-algo-trading-tool/,AI Solutions for Foreign Exchange - An Automated Algo Trading Tool,0,0,0,0,11,50,24.4,4,8,20,0,5.090909091
bctech2066,https://insights.blackcoffer.com/ai-agent-development-and-deployment-in-jina-ai/,AI agent development and Deployment in Jina AI,0,0,0,0,8,66.66666667,29.86666667,4,6,15,0,4.875
bctech2067,https://insights.blackcoffer.com/golden-record-a-knowledge-graph-database-approach-to-unfold-discovery-using-neo4j/,Golden Record - A knowledge graph database approach to unfold discovery using Neo4j,1,0,0.999999,0.076923071,13,40,21.2,4,10,24,0,5.461538462
bctech2068,https://insights.blackcoffer.com/advanced-ai-for-trading-automation/,Advanced AI for Trading Automation,1,0,0.999999,0.19999996,5,50,22,2,4,11,0,6
bctech2069,https://insights.blackcoffer.com/create-a-knowledge-graph-to-provide-real-time-analytics-recommendations-and-a-single-source-of-truth/,"Create a Knowledge Graph to Provide Real-time Analytics, Recommendations, and a Single Source of Truth",1,0,0.999999,0.058823526,17,30,18.8,3,10,30,0,5.176470588
bctech2070,https://insights.blackcoffer.com/advanced-ai-for-thermal-person-detection/,Advanced AI for Thermal Person Detection,1,0,0.999999,0.166666639,6,40,18.4,2,5,12,0,5.833333333
bctech2071,https://insights.blackcoffer.com/advanced-ai-for-road-cam-threat-detection/,Advanced AI for Road Cam Threat Detection,1,0,0.999999,0.142857122,7,33.33333333,16.13333333,2,6,11,0,5
bctech2072,https://insights.blackcoffer.com/advanced-ai-for-pedestrian-crossing-safety/,Advanced AI for Pedestrian Crossing Safety,1,0,0.999999,0.166666639,6,40,18.4,2,5,12,0,6.166666667
bctech2073,https://insights.blackcoffer.com/handgun-detection-using-yolo/,Advanced AI for Handgun Detection,1,0,0.999999,0.19999996,5,50,22,2,4,10,0,5.8
bctech2074,https://insights.blackcoffer.com/using-graph-technology-to-create-single-customer-view/,Using Graph Technology to Create Single Customer View.,0,0,0,0,4.5,28.57142857,13.22857143,2,7,15,0,5.222222222
bctech2075,https://insights.blackcoffer.com/car-detection-in-satellite-images/,Car Detection in Satellite Images,0,0,0,0,5,75,32,3,4,12,0,5.8
bctech2076,https://insights.blackcoffer.com/building-a-physics-informed-neural-network-for-circuit-evaluation/,Building a Physics-Informed Neural Network for Circuit Evaluation,0,0,0,0,8,33.33333333,16.53333333,2,6,18,0,7.25
bctech2077,https://insights.blackcoffer.com/connecting-mongodb-database-to-power-bi-dashboard-dashboard-automation/,Connecting MongoDB Database to Power BI Dashboard: Dashboard Automation,0,0,0,0,10,37.5,19,3,8,21,0,6.3
bctech2078,https://insights.blackcoffer.com/data-transformation/,Data Transformation,0,0,0,0,2,100,40.8,2,2,6,0,9
bctech2079,https://insights.blackcoffer.com/e-commerce-store-analysis-purchase-behavior-ad-spend-conversion-traffic-etc/,"E-commerce Store Analysis - Purchase Behavior, Ad Spend, Conversion, Traffic, etc...",0,0,0,0,4,36.36363636,16.14545455,4,11,23,0,4.625
bctech2080,https://insights.blackcoffer.com/kpi-dashboard-for-accountants/,KPI Dashboard for Accountants,0,0,0,0,4,33.33333333,14.93333333,1,3,7,0,6.5
bctech2081,https://insights.blackcoffer.com/return-on-advertising-spend-dashboard-marketing-automation-and-analytics-using-etl-and-dashboard/,Return on Advertising Spend Dashboard: Marketing Automation and Analytics using ETL and Dashboard,0,0,0,0,14,50,25.6,5,10,27,0,6.071428571
bctech2082,https://insights.blackcoffer.com/ranking-customer-behaviours-for-business-strategy/,Ranking customer behaviours for business strategy,0,0,0,0,6,60,26.4,3,5,14,0,7.333333333
bctech2083,https://insights.blackcoffer.com/algorithmic-trading-for-multiple-commodities-markets-like-forex-metals-energy-etc/,"Algorithmic trading for multiple commodities markets, like Forex, Metals, Energy, etc.",1,0,0.999999,0.062499996,8,50,23.2,5,10,25,0,4.75
bctech2084,https://insights.blackcoffer.com/trading-bot-for-forex/,Trading Bot for FOREX,0,0,0,0,4,0,1.6,0,3,6,0,4.5
bctech2085,https://insights.blackcoffer.com/python-model-for-the-analysis-of-sector-specific-stock-etfs-for-investment-purposes%ef%bf%bc/,Python model for the analysis of sector-specific stock ETFs for investment purposes,0,0,0,0,12,37.5,19.8,3,8,23,0,6
bctech2086,https://insights.blackcoffer.com/medical-classification/,Medical Classification,0,0,0,0,2,100,40.8,2,2,8,0,10.5
bctech2087,https://insights.blackcoffer.com/design-develop-bert-question-answering-model-explanations-with-visualization/,Design & Develop BERT Question Answering model explanations with visualization,0,0,0,0,10,62.5,29,5,8,23,0,6.9
bctech2088,https://insights.blackcoffer.com/design-and-develop-solution-to-anomaly-detection-classification-problems/,Design and develop solution to anomaly detection classification problems,0,0,0,0,9,71.42857143,32.17142857,5,7,23,0,7.111111111
bctech2089,https://insights.blackcoffer.com/an-etl-solution-for-currency-data-to-google-big-query/,An ETL Solution for Currency Data to Google Big Query,0,0,0,0,10,42.85714286,21.14285714,3,7,15,0,4.4
bctech2090,https://insights.blackcoffer.com/etl-and-mlops-infrastructure-for-blockchain-analytics/,ETL and MLOps Infrastructure for Blockchain Analytics,0,0,0,0,7,40,18.8,2,5,14,0,6.714285714
bctech2091,https://insights.blackcoffer.com/an-agent-based-model-of-a-virtual-power-plant-vpp/,An agent-based model of a Virtual Power Plant (VPP),0,0,0,0,11,16.66666667,11.06666667,1,6,14,0,3.909090909
bctech2092,https://insights.blackcoffer.com/transform-api-into-sdk-library-and-widget/,Transform API into SDK library and widget,0,0,0,0,7,40,18.8,2,5,11,0,5
bctech2093,https://insights.blackcoffer.com/integration-of-a-product-to-a-cloud-based-crm-platform/,Integration of a product to a cloud-based CRM platform,0,0,0,0,9,20,11.6,1,5,15,0,5.111111111
bctech2094,https://insights.blackcoffer.com/a-web-based-dashboard-for-the-filtered-data-retrieval-of-land-records/,A web-based dashboard for the filtered data retrieval of land records,0,0,0,0,11,42.85714286,21.54285714,3,7,20,0,5.363636364
bctech2095,https://insights.blackcoffer.com/integration-of-video-conferencing-data-to-the-existing-web-app/,Integration of video-conferencing data to the existing web app,0,0,0,0,9,50,23.6,3,6,20,0,6
bctech2096,https://insights.blackcoffer.com/design-develop-an-app-in-retool-which-shows-the-progress-of-the-added-video/,Design & develop an app in retool which shows the progress of the added video,1,0,0.999999,0.066666662,15,50,26,4,8,21,0,4.2
bctech2097,https://insights.blackcoffer.com/auvik-connectwise-integration-in-grafana/,"Auvik, Connectwise integration in Grafana",0,0,0,0,6,25,12.4,1,4,14,0,6.166666667
bctech2098,https://insights.blackcoffer.com/data-integration-and-big-data-performance-using-elk-stack/,Data integration and big data performance using Elasticsearch,0,0,0,0,8,57.14285714,26.05714286,4,7,20,0,6.75
bctech2099,https://insights.blackcoffer.com/web-data-connector/,Web Data Connector,0,0,0,0,3,66.66666667,27.86666667,2,3,6,0,5.333333333
bctech2100,https://insights.blackcoffer.com/an-app-for-updating-the-email-id-of-the-user-and-stripe-refund-tool-using-retool/,An app for updating the email id of the user and stripe refund tool using retool,1,0,0.999999,0.062499996,16,30,18.4,3,10,24,0,4.0625
bctech2101,https://insights.blackcoffer.com/an-ai-ml-based-web-application-that-detects-the-correctness-of-text-in-a-given-video/,An AI ML-based web application that detects the correctness of text in a given video,0,0,0,0,15,55.55555556,28.22222222,5,9,24,0,4.666666667
bctech2102,https://insights.blackcoffer.com/website-tracking-and-insights-using-google-analytics-google-tag-manager/,"Website Tracking and Insights using Google Analytics, & Google Tag Manager",0,0,0,0,12,22.22222222,13.68888889,2,9,21,0,5.333333333
bctech2103,https://insights.blackcoffer.com/dashboard-to-track-the-analytics-of-the-website-using-google-analytics-and-google-tag-manager/,,,,,,0,0,0,0,0,0,0,0
bctech2104,https://insights.blackcoffer.com/power-bi-dashboard-on-operations-transactions-and-marketing-embedding-the-dashboard-to-web-app/,"Power BI Dashboard on Operations, Transactions, and Marketing, Anaytics",0,0,0,0,12,42.85714286,21.94285714,3,7,20,0,5.25
bctech2105,https://insights.blackcoffer.com/nft-data-automation-looksrare-and-etl-tool/,"NFT Data Automation (looksrare), and ETL tool",0,0,0,0,10,33.33333333,17.33333333,2,6,12,0,3.9
bctech2106,https://insights.blackcoffer.com/optimize-the-data-scraper-program-to-easily-accommodate-large-files-and-solve-oom-errors/,Optimize the data scraper program to easily accommodate large files and solve OOM errors,0,0,0,0,14,36.36363636,20.14545455,4,11,29,0,5.357142857
bctech2107,https://insights.blackcoffer.com/making-a-robust-way-to-sync-data-from-airtables-to-mongodb-using-python-etl-solution/,Making a robust way to sync data from airtables to mongoDB using python - ETL Solution,1,0,0.999999,0.062499996,16,18.18181818,13.67272727,2,11,23,0,4.4375
bctech2108,https://insights.blackcoffer.com/incident-duration-prediction-infrastructure-and-real-estate/,Incident Duration Prediction - Infrastructure and Real Estate,0,0,0,0,8,66.66666667,29.86666667,4,6,18,0,6.75
bctech2109,https://insights.blackcoffer.com/statistical-data-analysis-of-reinforced-concrete/,Statistical Data Analysis of Reinforced Concrete,0,0,0,0,6,100,42.4,5,5,15,0,7.166666667
bctech2110,https://insights.blackcoffer.com/database-normalization-segmentation-with-google-data-studio-dashboard-insights/,Database Normalization & Segmentation with Google Data Studio Dashboard Insights,0,0,0,0,10,62.5,29,5,8,24,0,7.1
bctech2111,https://insights.blackcoffer.com/power-bi-dashboard-to-drive-insights-from-complex-data-to-generate-business-insights/,Power BI dashboard to drive insights from complex data to generate business insights,0,0,0,0,13,40,21.2,4,10,25,0,5.538461538
bctech2112,https://insights.blackcoffer.com/real-time-dashboard-to-monitor-infrastructure-activity-and-machines/,Real-time dashboard to monitor infrastructure activity and Machines,0,0,0,0,8,50,23.2,3,6,21,0,7.5
bctech2113,https://insights.blackcoffer.com/electric-vehicles-ev-load-management-system-to-forecast-energy-demand/,Electric Vehicles (EV) Load Management System to Forecast Energy Demand,0,0,0,0,12,44.44444444,22.57777778,4,9,21,0,5.166666667
bctech2114,https://insights.blackcoffer.com/power-bi-data-driven-map-dashboard/,Power BI Data-Driven Map Dashboard,0,0,0,0,5,0,2,0,5,10,0,6
bctech2115,https://insights.blackcoffer.com/google-local-service-ads-lsa-leads-dashboard/,Google Local Service Ads (LSA) Leads Dashboard,1,0,0.999999,0.111111099,9,14.28571429,9.314285714,1,7,12,0,4.444444444
bctech2116,https://insights.blackcoffer.com/aws-lex-voice-and-chatbot/,AWS Lex Voice and Chatbot,0,0,0,0,5,0,2,0,4,7,0,4.2
bctech2117,https://insights.blackcoffer.com/metabridges-api-decentraland-integration/,"MetaBridges API Decentraland Integration - AR, VR",0,0,0,0,8,16.66666667,9.866666667,1,6,15,0,5.375
bctech2118,https://insights.blackcoffer.com/microsoft-azure-chatbot-with-luis-language-understanding/,Microsoft Azure chatbot with LUIS (Language Understanding),0,0,0,0,9,50,23.6,3,6,17,0,5.777777778
bctech2119,https://insights.blackcoffer.com/impact-of-news-media-and-press-on-innovation-startups-and-investments/,"Impact of news, media, and press on innovation, startups, and investments",1,0,0.999999,0.066666662,15,57.14285714,28.85714286,4,7,19,0,4.2
bctech2120,https://insights.blackcoffer.com/aws-quicksight-reporting-dashboard/,AWS QuickSight Reporting Dashboard,0,0,0,0,4,25,11.6,1,4,8,0,7.75
bctech2121,https://insights.blackcoffer.com/google-data-studio-dashboard-for-marketing-ads-and-traction-data/,"Google Data Studio Dashboard for Marketing, ads and Traction data",0,0,0,0,11,50,24.4,4,8,18,0,5.090909091
bctech2122,https://insights.blackcoffer.com/gangala-in-e-commerce-big-data-etl-elt-solution-and-data-warehouse/,Gangala.in: E-commerce Big Data ETL / ELT Solution and Data Warehouse,0,0,0,0,6,33.33333333,15.73333333,3,9,22,0,4.916666667
bctech2123,https://insights.blackcoffer.com/big-data-solution-to-an-online-multivendor-marketplace-ecommerce-business/,Big Data solution to an online multivendor marketplace eCommerce business,0,0,0,0,10,50,24,4,8,26,0,6.4
bctech2124,https://insights.blackcoffer.com/creating-a-custom-report-and-dashboard-using-the-data-got-from-atera-api/,Creating a custom report and dashboard using the data got from Atera API,0,0,0,0,13,33.33333333,18.53333333,3,9,22,0,4.615384615
bctech2125,https://insights.blackcoffer.com/azure-data-lake-and-power-bi-dashboard/,Azure Data Lake and Power BI Dashboard,0,0,0,0,7,16.66666667,9.466666667,1,6,13,0,4.571428571
bctech2126,https://insights.blackcoffer.com/google-data-studio-pipeline-with-gcp-mysql/,Google Data Studio Pipeline with GCP/MySQL,0,0,0,0,6,40,18.4,2,5,11,0,6.166666667
bctech2127,https://insights.blackcoffer.com/quickbooks-dashboard-to-find-patterns-in-finance-sales-and-forecasts/,"QuickBooks dashboard to find patterns in finance, sales, and forecasts",0,0,0,0,12,28.57142857,16.22857143,2,7,18,0,5.083333333
