bctech2128,https://insights.blackcoffer.com/marketing-sales-and-financial-data-business-dashboard-wink-report/,"Marketing, sales, and financial data business dashboard (Wink Report)",0,0,0,0,13,62.5,30.2,5,8,19,0,4.692307692
bctech2129,https://insights.blackcoffer.com/react-native-apps-in-the-development-portfolio/,React Native Apps in the Development Portfolio,0,0,0,0,7,40,18.8,2,5,14,0,5.714285714
bctech2130,https://insights.blackcoffer.com/a-leading-firm-website-seo-optimization/,"A Leading Law Firm in the USA, Website SEO & Optimization",1,0,0.999999,0.083333326,12,42.85714286,21.94285714,3,7,18,0,3.916666667
bctech2131,https://insights.blackcoffer.com/a-leading-hospitality-firm-in-the-usa-website-seo-optimization/,"A Leading Hospitality Firm in the USA, Website SEO & Optimization",1,0,0.999999,0.083333326,12,57.14285714,27.65714286,4,7,21,0,4.583333333
bctech2132,https://insights.blackcoffer.com/a-leading-firm-in-the-usa-website-seo-optimization/,"A Leading Firm in the USA, Website SEO & Optimization",1,0,0.999999,0.090909083,11,50,24.4,3,6,17,0,4
bctech2133,https://insights.blackcoffer.com/a-leading-musical-instrumental-website-seo-optimization/,"A Leading Musical Instrumental, Website SEO & Optimization",2,0,0.9999995,0.222222198,9,66.66666667,30.26666667,4,6,19,0,5.666666667
bctech2134,https://insights.blackcoffer.com/a-leading-firm-in-the-usa-seo-and-website-optimization/,"A Leading Firm in the USA, SEO and Website Optimization",1,0,0.999999,0.090909083,11,50,24.4,3,6,18,0,4.181818182
bctech2135,https://insights.blackcoffer.com/immigration-datawarehouse-ai-based-recommendations/,Immigration Datawarehouse & AI-based recommendations,1,0,0.999999,0.19999996,5,50,22,2,4,18,0,9.6
bctech2136,https://insights.blackcoffer.com/lipsync-automation-for-celebrities-and-influencers/,Lipsync Automation for Celebrities and Influencers,0,0,0,0,6,50,22.4,2,4,14,0,7.5
bctech2137,https://insights.blackcoffer.com/key-audit-matters-predictive-modeling/,Key Audit Matters Predictive Modeling,0,0,0,0,5,40,18,2,5,12,0,6.6
bctech2138,https://insights.blackcoffer.com/splitting-of-songs-into-its-vocals-and-instrumental/,Splitting of Songs into its Vocals and Instrumental,1,0,0.999999,0.124999984,8,25,13.2,1,4,14,1,5.5
bctech2139,https://insights.blackcoffer.com/ai-and-ml-technologies-to-evaluate-learning-assessments/,AI and ML technologies to Evaluate Learning Assessments,0,0,0,0,8,66.66666667,29.86666667,4,6,16,0,6
bctech2140,https://insights.blackcoffer.com/datawarehouse-and-recommendations-engine-for-airbnb/,"Datawarehouse, and Recommendations Engine for AirBNB",1,0,0.999999,0.142857122,7,50,22.8,2,4,17,0,6.714285714
bctech2141,https://insights.blackcoffer.com/real-estate-data-warehouse/,Real Estate Data Warehouse,0,0,0,0,4,25,11.6,1,4,9,0,5.75
bctech2142,https://insights.blackcoffer.com/traction-dashboards-of-marketing-campaigns-and-posts/,Traction Dashboards of Marketing Campaigns and Posts,0,0,0,0,7,40,18.8,2,5,12,0,6.571428571
bctech2143,https://insights.blackcoffer.com/google-local-service-ads-lsa-data-warehouse/,Google Local Service Ads (LSA) Data Warehouse,0,0,0,0,9,28.57142857,15.02857143,2,7,14,0,4.333333333
bctech2144,https://insights.blackcoffer.com/google-local-service-ads-missed-calls-and-messages-automation-tool/,Google Local Service Ads Missed Calls and Messages Automation Tool,0,0,0,0,10,33.33333333,17.33333333,3,9,20,0,5.7
bctech2145,https://insights.blackcoffer.com/marketing-ads-leads-call-status-data-tool-to-bigquery/,Marketing Ads Leads Call Status Data Tool to BigQuery,1,0,0.999999,0.111111099,9,37.5,18.6,3,8,14,0,5
bctech2146,https://insights.blackcoffer.com/marketing-analytics-to-automate-leads-call-status-and-reporting/,Marketing Analytics to Automate Leads Call Status and Reporting,1,0,0.999999,0.111111099,9,71.42857143,32.17142857,5,7,19,0,6.111111111
bctech2147,https://insights.blackcoffer.com/callrail-analytics-leads-report-alert/,"CallRail, Analytics & Leads Report Alert",1,0,0.999999,0.142857122,7,40,18.8,2,5,10,0,5
bctech2148,https://insights.blackcoffer.com/marketing-automation-tool-to-notify-lead-details-to-clients-over-email-and-phone/,Marketing Tool to Notify Leads to Clients over Email and Phone,1,0,0.999999,0.090909083,11,28.57142857,15.82857143,2,7,16,0,4.727272727
bctech2149,https://insights.blackcoffer.com/data-etl-local-service-ads-leads-to-bigquery/,Data ETL: Local Service Ads Leads to BigQuery,1,0,0.999999,0.111111099,9,28.57142857,15.02857143,2,7,13,0,4.222222222
bctech2150,https://insights.blackcoffer.com/marbles-stimulation-using-python/,Marbles Stimulation using python,0,0,0,0,4,25,11.6,1,4,9,0,7.25
bctech2151,https://insights.blackcoffer.com/stocktwits-data-structurization/,Stocktwits Data Structurization,0,0,0,0,3,33.33333333,14.53333333,1,3,9,0,9.666666667
bctech2152,https://insights.blackcoffer.com/sentimental-analysis-on-shareholder-letter-of-companies/,Sentimental Analysis on Shareholder Letter of Companies,0,0,0,0,7,80,34.8,4,5,18,0,7
bctech2153,https://insights.blackcoffer.com/population-and-community-survey-of-america/,Population and Community Survey of America,0,0,0,0,6,100,42.4,4,4,15,0,6.166666667
bctech2154,https://insights.blackcoffer.com/google-lsa-api-data-automation-and-dashboarding/,Google LSA API Data Automation and Dashboarding,0,0,0,0,7,33.33333333,16.13333333,2,6,15,0,5.857142857
bctech2155,https://insights.blackcoffer.com/healthcare-data-analysis/,Healthcare Data Analysis,0,0,0,0,3,66.66666667,27.86666667,2,3,8,0,7.333333333
bctech2156,https://insights.blackcoffer.com/budget-sales-kpi-dashboard-using-power-bi/,"Budget, Sales KPI Dashboard using Power BI",0,0,0,0,8,0,3.2,0,7,12,0,4.5
bctech2157,https://insights.blackcoffer.com/amazon-buy-bot-an-automation-ai-tool-to-auto-checkouts/,"Amazon Buy Bot, an Automation AI tool to Auto-Checkouts",0,0,0,0,10,42.85714286,21.14285714,3,7,17,0,4.7
